{
  "categories": {
    "image-12gb": {
      "reference_gpu": "rtx3060-12",
      "task": "image",
      "title": "Top image models \u2014 12 GB GPU",
      "top": [
        {
          "id": "sdxl-base-1.0",
          "score": 0.8194
        },
        {
          "id": "sd15",
          "score": 0.7584
        },
        {
          "id": "realistic-vision-5.1",
          "score": 0.7408
        },
        {
          "id": "sd3.5-medium",
          "score": 0.736
        },
        {
          "id": "flux1-schnell",
          "score": 0.6131
        },
        {
          "id": "flux1-dev",
          "score": 0.5916
        },
        {
          "id": "sd3.5-large",
          "score": 0.5275
        }
      ]
    },
    "image-16gb": {
      "reference_gpu": "rtx4060ti-16",
      "task": "image",
      "title": "Top image models \u2014 16 GB GPU",
      "top": [
        {
          "id": "sdxl-base-1.0",
          "score": 0.8194
        },
        {
          "id": "flux1-schnell",
          "score": 0.7731
        },
        {
          "id": "sd15",
          "score": 0.7584
        },
        {
          "id": "flux1-dev",
          "score": 0.7516
        },
        {
          "id": "realistic-vision-5.1",
          "score": 0.7408
        },
        {
          "id": "sd3.5-medium",
          "score": 0.736
        },
        {
          "id": "sd3.5-large",
          "score": 0.6875
        }
      ]
    },
    "image-24gb": {
      "reference_gpu": "rtx4090-24",
      "task": "image",
      "title": "Top image models \u2014 24 GB GPU",
      "top": [
        {
          "id": "flux1-schnell",
          "score": 0.8931
        },
        {
          "id": "flux1-dev",
          "score": 0.8716
        },
        {
          "id": "sdxl-base-1.0",
          "score": 0.8194
        },
        {
          "id": "sd3.5-large",
          "score": 0.8075
        },
        {
          "id": "sd15",
          "score": 0.7584
        },
        {
          "id": "realistic-vision-5.1",
          "score": 0.7408
        },
        {
          "id": "sd3.5-medium",
          "score": 0.736
        }
      ]
    },
    "video-12gb": {
      "reference_gpu": "rtx3060-12",
      "task": "video",
      "title": "Top video models \u2014 12 GB GPU",
      "top": [
        {
          "id": "ltx-video-2b-0.9.1",
          "score": 0.7464
        },
        {
          "id": "wan2.1-t2v-1.3b",
          "score": 0.6946
        },
        {
          "id": "svd-xt-1.1",
          "score": 0.6652
        },
        {
          "id": "hunyuanvideo-q4",
          "score": 0.6402
        },
        {
          "id": "wan2.2-ti2v-5b",
          "score": 0.6125
        }
      ]
    },
    "video-16gb": {
      "reference_gpu": "rtx4060ti-16",
      "task": "video",
      "title": "Top video models \u2014 16 GB GPU",
      "top": [
        {
          "id": "hunyuanvideo-q4",
          "score": 0.7602
        },
        {
          "id": "ltx-video-2b-0.9.1",
          "score": 0.7464
        },
        {
          "id": "wan2.2-ti2v-5b",
          "score": 0.7325
        },
        {
          "id": "wan2.1-t2v-1.3b",
          "score": 0.6946
        },
        {
          "id": "svd-xt-1.1",
          "score": 0.6652
        },
        {
          "id": "mochi-1-preview",
          "score": 0.475
        },
        {
          "id": "cogvideox-1.5-5b-i2v",
          "score": 0.406
        }
      ]
    },
    "video-24gb": {
      "reference_gpu": "rtx4090-24",
      "task": "video",
      "title": "Top video models \u2014 24 GB GPU",
      "top": [
        {
          "id": "hunyuanvideo-q4",
          "score": 0.7602
        },
        {
          "id": "mochi-1-preview",
          "score": 0.755
        },
        {
          "id": "ltx-video-2b-0.9.1",
          "score": 0.7464
        },
        {
          "id": "wan2.2-ti2v-5b",
          "score": 0.7325
        },
        {
          "id": "wan2.1-t2v-1.3b",
          "score": 0.6946
        },
        {
          "id": "cogvideox-1.5-5b-i2v",
          "score": 0.686
        },
        {
          "id": "svd-xt-1.1",
          "score": 0.6652
        }
      ]
    }
  },
  "generated_at": "2026-10-21",
  "media_ranking_version": "1.0",
  "models": {
    "cogvideox-1.5-5b-i2v": {
      "components": {
        "capability": 0.6616,
        "momentum": 0.4391,
        "speed": 0.1087
      },
      "cost": {
        "frames": 81,
        "megapixels": 1.04,
        "steps": 50
      },
      "download_gb": 20.0,
      "family": "cogvideo",
      "fits": {
        "rtx3060-12": {
          "verdict": "no"
        },
        "rtx4060ti-16": {
          "verdict": "offload"
        },
        "rtx4090-24": {
          "verdict": "fits"
        }
      },
      "hf_id": "THUDM/CogVideoX1.5-5B-I2V",
      "hf_stats": {
        "downloads_30d": 1184,
        "fetched_at": "2026-10-21",
        "likes": 124
      },
      "homepilot": {
        "model_id": "cogvideox1.5_5b_i2v_snapshot",
        "model_type": "video",
        "provider": "comfyui"
      },
      "id": "cogvideox-1.5-5b-i2v",
      "license": "cogvideox",
      "name": "CogVideoX 1.5 5B I2V",
      "params_b": 5.0,
      "scores": {
        "rtx3060-12": 0.286,
        "rtx4060ti-16": 0.406,
        "rtx4090-24": 0.686
      },
      "task": "image-to-video",
      "vram_gb": {
        "min": 18,
        "recommended": 24,
        "source": "homepilot-presets"
      }
    },
    "flux1-dev": {
      "components": {
        "capability": 0.9472,
        "momentum": 0.8304,
        "speed": 0.2718
      },
      "cost": {
        "megapixels": 1.05,
        "steps": 28
      },
      "download_gb": 23.8,
      "family": "flux",
      "fits": {
        "rtx3060-12": {
          "verdict": "offload"
        },
        "rtx4060ti-16": {
          "verdict": "tight"
        },
        "rtx4090-24": {
          "verdict": "fits"
        }
      },
      "hf_id": "black-forest-labs/FLUX.1-dev",
      "hf_stats": {
        "downloads_30d": 650318,
        "fetched_at": "2026-10-21",
        "likes": 15672
      },
      "homepilot": {
        "model_id": "flux1-dev.safetensors",
        "model_type": "image",
        "provider": "comfyui"
      },
      "id": "flux1-dev",
      "license": "flux-1-dev-non-commercial-license",
      "name": "FLUX.1 dev",
      "params_b": 12.0,
      "scores": {
        "rtx3060-12": 0.5916,
        "rtx4060ti-16": 0.7516,
        "rtx4090-24": 0.8716
      },
      "task": "text-to-image",
      "vram_gb": {
        "min": 16,
        "recommended": 24,
        "source": "editorial"
      }
    },
    "flux1-schnell": {
      "components": {
        "capability": 0.9472,
        "momentum": 0.8207,
        "speed": 0.5112
      },
      "cost": {
        "megapixels": 1.05,
        "steps": 4
      },
      "download_gb": 23.8,
      "family": "flux",
      "fits": {
        "rtx3060-12": {
          "verdict": "offload"
        },
        "rtx4060ti-16": {
          "verdict": "tight"
        },
        "rtx4090-24": {
          "verdict": "fits"
        }
      },
      "hf_id": "black-forest-labs/FLUX.1-schnell",
      "hf_stats": {
        "downloads_30d": 556106,
        "fetched_at": "2026-10-21",
        "likes": 6375
      },
      "homepilot": {
        "model_id": "flux1-schnell.safetensors",
        "model_type": "image",
        "provider": "comfyui"
      },
      "id": "flux1-schnell",
      "license": "apache-2.0",
      "name": "FLUX.1 schnell",
      "params_b": 12.0,
      "scores": {
        "rtx3060-12": 0.6131,
        "rtx4060ti-16": 0.7731,
        "rtx4090-24": 0.8931
      },
      "task": "text-to-image",
      "vram_gb": {
        "min": 16,
        "recommended": 24,
        "source": "editorial"
      }
    },
    "hunyuanvideo-q4": {
      "components": {
        "capability": 0.9745,
        "momentum": 0.4621,
        "speed": 0.011
      },
      "cost": {
        "frames": 129,
        "megapixels": 0.92,
        "steps": 30
      },
      "download_gb": 9.5,
      "family": "hunyuan",
      "fits": {
        "rtx3060-12": {
          "verdict": "tight"
        },
        "rtx4060ti-16": {
          "verdict": "fits"
        },
        "rtx4090-24": {
          "verdict": "fits"
        }
      },
      "hf_id": "tencent/HunyuanVideo",
      "hf_stats": {
        "downloads_30d": 1716,
        "fetched_at": "2026-10-21",
        "likes": 2340
      },
      "homepilot": {
        "model_id": "hunyuanvideo_t2v_720p_gguf_q4_k_m_pack",
        "model_type": "video",
        "provider": "comfyui"
      },
      "id": "hunyuanvideo-q4",
      "license": "tencent-hunyuan-community",
      "name": "HunyuanVideo 720p (GGUF Q4_K_M)",
      "params_b": 13.0,
      "scores": {
        "rtx3060-12": 0.6402,
        "rtx4060ti-16": 0.7602,
        "rtx4090-24": 0.7602
      },
      "task": "text-to-video",
      "vram_gb": {
        "min": 12,
        "recommended": 16,
        "source": "homepilot-presets"
      }
    },
    "ltx-video-2b-0.9.1": {
      "components": {
        "capability": 0.4057,
        "momentum": 0.8474,
        "speed": 0.3312
      },
      "cost": {
        "frames": 97,
        "megapixels": 0.6,
        "steps": 30
      },
      "download_gb": 10.5,
      "family": "ltx",
      "fits": {
        "rtx3060-12": {
          "verdict": "fits"
        },
        "rtx4060ti-16": {
          "verdict": "fits"
        },
        "rtx4090-24": {
          "verdict": "fits"
        }
      },
      "hf_id": "Lightricks/LTX-Video",
      "hf_stats": {
        "downloads_30d": 854981,
        "fetched_at": "2026-10-21",
        "likes": 2365
      },
      "homepilot": {
        "model_id": "ltx-video-2b-v0.9.1.safetensors",
        "model_type": "video",
        "provider": "comfyui"
      },
      "id": "ltx-video-2b-0.9.1",
      "license": "ltx-video-open-weights",
      "name": "LTX-Video 2B 0.9.1",
      "params_b": 2.0,